{
  "schema_version": "searchworthyor.rapid_model_ir.v0",
  "id": "SWOR-R094",
  "family": "production_capacity",
  "source_candidate_id": "V141-SWOR-R094",
  "variables": [
    {
      "name": "air_45psi",
      "type": "BINARY",
      "lb": 0,
      "ub": 1,
      "meaning": "采用喷嘴处实测45 psi的压缩空气清洁方案"
    },
    {
      "name": "air_25psi",
      "type": "BINARY",
      "lb": 0,
      "ub": 1,
      "meaning": "采用喷嘴处实测25 psi的压缩空气清洁方案"
    },
    {
      "name": "vacuum_clean",
      "type": "BINARY",
      "lb": 0,
      "ub": 1,
      "meaning": "采用工业吸尘清洁方案"
    },
    {
      "name": "air_20psi",
      "type": "BINARY",
      "lb": 0,
      "ub": 1,
      "meaning": "采用喷嘴处实测20 psi的压缩空气清洁方案"
    },
    {
      "name": "no_protection",
      "type": "BINARY",
      "lb": 0,
      "ub": 1,
      "meaning": "不配置碎屑防护或个人防护装备"
    },
    {
      "name": "chip_guard_only",
      "type": "BINARY",
      "lb": 0,
      "ub": 1,
      "meaning": "仅配置有效碎屑防护"
    },
    {
      "name": "ppe_only",
      "type": "BINARY",
      "lb": 0,
      "ub": 1,
      "meaning": "仅配置完整个人防护装备"
    },
    {
      "name": "guard_and_ppe",
      "type": "BINARY",
      "lb": 0,
      "ub": 1,
      "meaning": "同时配置有效碎屑防护和完整个人防护装备"
    }
  ],
  "objective": {
    "sense": "max",
    "constant": 0,
    "coefficients": {
      "air_45psi": 120,
      "air_25psi": 112,
      "vacuum_clean": 100,
      "air_20psi": 98,
      "no_protection": 0,
      "chip_guard_only": -4,
      "ppe_only": -3,
      "guard_and_ppe": -9
    },
    "meaning": "生产设备清洁方案效用减去防护配置成本",
    "unit": "生产效用点"
  },
  "action_projection": [
    "air_45psi",
    "air_25psi",
    "vacuum_clean",
    "air_20psi",
    "no_protection",
    "chip_guard_only",
    "ppe_only",
    "guard_and_ppe"
  ],
  "variant": "base",
  "constraints": [
    {
      "name": "choose_cleaning_method",
      "sense": "=",
      "rhs": 1,
      "coefficients": {
        "air_45psi": 1,
        "air_25psi": 1,
        "vacuum_clean": 1,
        "air_20psi": 1
      },
      "meaning": "恰好选择一种清洁方式"
    },
    {
      "name": "choose_protection_package",
      "sense": "=",
      "rhs": 1,
      "coefficients": {
        "no_protection": 1,
        "chip_guard_only": 1,
        "ppe_only": 1,
        "guard_and_ppe": 1
      },
      "meaning": "恰好选择一种防护配置"
    }
  ]
}
