{
  "schema_version": "searchworthyor.rapid_model_ir.v0",
  "id": "SWOR-R075",
  "variant": "patched",
  "family": "routing_transport",
  "source_candidate_id": "UK-EA-THAMES-NAVIGATION-2026-08-03",
  "variables": [
    {
      "name": "arc_b",
      "type": "BINARY",
      "lb": 0,
      "ub": 1,
      "meaning": "从上游汇合点经Bray绕行航段到下游汇合点"
    },
    {
      "name": "arc_c",
      "type": "BINARY",
      "lb": 0,
      "ub": 1,
      "meaning": "从起点经Caversham常规航段到上游汇合点"
    },
    {
      "name": "arc_a",
      "type": "BINARY",
      "lb": 0,
      "ub": 1,
      "meaning": "从上游汇合点经Boulters Lock捷径到下游汇合点"
    },
    {
      "name": "arc_d",
      "type": "BINARY",
      "lb": 0,
      "ub": 1,
      "meaning": "从起点经Sonning侧航道到上游汇合点"
    },
    {
      "name": "arc_f",
      "type": "BINARY",
      "lb": 0,
      "ub": 1,
      "meaning": "从下游汇合点经Teddington Barge Lock到终点"
    },
    {
      "name": "arc_g",
      "type": "BINARY",
      "lb": 0,
      "ub": 1,
      "meaning": "从起点经陆路吊运直接到下游汇合点"
    },
    {
      "name": "arc_e",
      "type": "BINARY",
      "lb": 0,
      "ub": 1,
      "meaning": "从下游汇合点经Teddington Launch Lock到终点"
    },
    {
      "name": "arc_h",
      "type": "BINARY",
      "lb": 0,
      "ub": 1,
      "meaning": "从上游汇合点经公路拖运直接到终点"
    }
  ],
  "objective": {
    "sense": "min",
    "constant": 0,
    "coefficients": {
      "arc_a": 2,
      "arc_b": 5,
      "arc_c": 2,
      "arc_d": 4,
      "arc_e": 1,
      "arc_f": 3,
      "arc_g": 8,
      "arc_h": 7
    },
    "meaning": "一艘作业艇从起点到终点的总转运成本",
    "unit": "成本点"
  },
  "constraints": [
    {
      "name": "source_flow",
      "sense": "=",
      "rhs": 1,
      "coefficients": {
        "arc_c": 1,
        "arc_d": 1,
        "arc_g": 1
      },
      "meaning": "起点流出一条路线"
    },
    {
      "name": "upper_balance",
      "sense": "=",
      "rhs": 0,
      "coefficients": {
        "arc_c": 1,
        "arc_d": 1,
        "arc_a": -1,
        "arc_b": -1,
        "arc_h": -1
      },
      "meaning": "上游汇合点流量平衡"
    },
    {
      "name": "lower_balance",
      "sense": "=",
      "rhs": 0,
      "coefficients": {
        "arc_a": 1,
        "arc_b": 1,
        "arc_g": 1,
        "arc_e": -1,
        "arc_f": -1
      },
      "meaning": "下游汇合点流量平衡"
    },
    {
      "name": "sink_flow",
      "sense": "=",
      "rhs": 1,
      "coefficients": {
        "arc_e": 1,
        "arc_f": 1,
        "arc_h": 1
      },
      "meaning": "终点流入一条路线"
    },
    {
      "name": "bar_boulters_for_width",
      "sense": "=",
      "rhs": 0,
      "coefficients": {
        "arc_a": 1
      },
      "meaning": "船宽超过Boulters Lock当前限宽"
    },
    {
      "name": "bar_teddington_launch_lock",
      "sense": "=",
      "rhs": 0,
      "coefficients": {
        "arc_e": 1
      },
      "meaning": "Teddington Launch Lock当前关闭"
    }
  ],
  "action_projection": [
    "arc_b",
    "arc_c",
    "arc_a",
    "arc_d",
    "arc_f",
    "arc_g",
    "arc_e",
    "arc_h"
  ]
}
