{
  "schema_version": "searchworthyor.rapid_model_ir.v0",
  "id": "SWOR-R056",
  "variant": "base",
  "family": "routing_transport",
  "source_candidate_id": "US-NPS-BLUE-RIDGE-CLOSURES-2026-08-04",
  "variables": [
    {
      "name": "select_a",
      "type": "BINARY",
      "lb": 0,
      "ub": 1,
      "meaning": "执行接驳路线A"
    },
    {
      "name": "select_b",
      "type": "BINARY",
      "lb": 0,
      "ub": 1,
      "meaning": "执行接驳路线B"
    },
    {
      "name": "select_c",
      "type": "BINARY",
      "lb": 0,
      "ub": 1,
      "meaning": "执行接驳路线C"
    },
    {
      "name": "select_d",
      "type": "BINARY",
      "lb": 0,
      "ub": 1,
      "meaning": "执行接驳路线D"
    },
    {
      "name": "select_e",
      "type": "BINARY",
      "lb": 0,
      "ub": 1,
      "meaning": "执行接驳路线E"
    },
    {
      "name": "select_f",
      "type": "BINARY",
      "lb": 0,
      "ub": 1,
      "meaning": "执行接驳路线F"
    }
  ],
  "objective": {
    "sense": "max",
    "constant": 0,
    "coefficients": {
      "select_a": 12,
      "select_b": 11,
      "select_c": 10,
      "select_d": 9,
      "select_e": 8,
      "select_f": 7
    },
    "meaning": "两条公园接驳路线的总服务收益",
    "unit": "收益点"
  },
  "constraints": [
    {
      "name": "choose_two",
      "sense": "=",
      "rhs": 2,
      "coefficients": {
        "select_a": 1,
        "select_b": 1,
        "select_c": 1,
        "select_d": 1,
        "select_e": 1,
        "select_f": 1
      },
      "meaning": "恰好选择两个候选"
    }
  ],
  "action_projection": [
    "select_a",
    "select_b",
    "select_c",
    "select_d",
    "select_e",
    "select_f"
  ]
}
