{
  "schema_version": "searchworthyor.rapid_model_ir.v0",
  "id": "SWOR-R109",
  "variant": "base",
  "family": "facility_network",
  "source_candidate_id": "LOW-D2-R109-OSHA-EXTINGUISHER-DISTANCE",
  "variables": [
    {
      "name": "classb_65",
      "type": "BINARY",
      "lb": 0,
      "ub": 1,
      "meaning": "采用最近灭火器距易燃液体危险区65英尺的布局A"
    },
    {
      "name": "classb_48",
      "type": "BINARY",
      "lb": 0,
      "ub": 1,
      "meaning": "采用最近灭火器距易燃液体危险区48英尺的布局B"
    },
    {
      "name": "classa_70",
      "type": "BINARY",
      "lb": 0,
      "ub": 1,
      "meaning": "采用最近灭火器距普通可燃物区70英尺的布局C"
    },
    {
      "name": "classd_monthly",
      "type": "BINARY",
      "lb": 0,
      "ub": 1,
      "meaning": "采用可燃金属屑仅每月产生一次且最近D类灭火剂70英尺的布局D"
    },
    {
      "name": "none",
      "type": "BINARY",
      "lb": 0,
      "ub": 1,
      "meaning": "不调整灭火设备点位"
    },
    {
      "name": "move_classb",
      "type": "BINARY",
      "lb": 0,
      "ub": 1,
      "meaning": "移动Class B灭火器使行走距离降至50英尺"
    },
    {
      "name": "add_classa",
      "type": "BINARY",
      "lb": 0,
      "ub": 1,
      "meaning": "增设普通可燃物区灭火器站"
    },
    {
      "name": "add_classd",
      "type": "BINARY",
      "lb": 0,
      "ub": 1,
      "meaning": "增设可燃金属区灭火剂站"
    }
  ],
  "objective": {
    "sense": "max",
    "constant": 0,
    "coefficients": {
      "classb_65": 80,
      "classb_48": 72,
      "classa_70": 68,
      "classd_monthly": 76,
      "none": 0,
      "move_classb": -8,
      "add_classa": -4,
      "add_classd": -6
    },
    "meaning": "题列决策的唯一目标",
    "unit": "设施防护净效用点"
  },
  "constraints": [
    {
      "name": "choose_layout",
      "sense": "=",
      "rhs": 1,
      "coefficients": {
        "classb_65": 1,
        "classb_48": 1,
        "classa_70": 1,
        "classd_monthly": 1
      },
      "meaning": "选择一个生产设施布局"
    },
    {
      "name": "choose_package",
      "sense": "=",
      "rhs": 1,
      "coefficients": {
        "none": 1,
        "move_classb": 1,
        "add_classa": 1,
        "add_classd": 1
      },
      "meaning": "选择一个灭火设备调整包"
    },
    {
      "name": "move_b_only_layout_a",
      "sense": "<=",
      "rhs": 0,
      "coefficients": {
        "move_classb": 1,
        "classb_65": -1
      },
      "meaning": "B类移动包仅服务布局A"
    },
    {
      "name": "add_a_only_layout_c",
      "sense": "<=",
      "rhs": 0,
      "coefficients": {
        "add_classa": 1,
        "classa_70": -1
      },
      "meaning": "A类增设包仅服务布局C"
    },
    {
      "name": "add_d_only_layout_d",
      "sense": "<=",
      "rhs": 0,
      "coefficients": {
        "add_classd": 1,
        "classd_monthly": -1
      },
      "meaning": "D类增设包仅服务布局D"
    }
  ],
  "action_projection": [
    "classb_65",
    "classb_48",
    "classa_70",
    "classd_monthly",
    "none",
    "move_classb",
    "add_classa",
    "add_classd"
  ]
}
