{
  "schema_version": "searchworthyor.rapid_model_ir.v0",
  "id": "SWOR-R045",
  "variant": "base",
  "family": "facility_network",
  "source_candidate_id": "US-EPA-HFC-ALD-2026-01",
  "variables": [
    {
      "name": "select_a",
      "type": "BINARY",
      "lb": 0,
      "ub": 1,
      "meaning": "纳入2027年制冷设施网络的A号密闭商业冷藏机组：2026年2月安装，满充注量1,600磅，制冷剂GWP为1,430"
    },
    {
      "name": "select_b",
      "type": "BINARY",
      "lb": 0,
      "ub": 1,
      "meaning": "纳入2027年制冷设施网络的B号开放式商业冷藏机组：2026年3月安装，满充注量1,600磅，制冷剂GWP为1"
    },
    {
      "name": "select_c",
      "type": "BINARY",
      "lb": 0,
      "ub": 1,
      "meaning": "纳入2027年制冷设施网络的C号工业工艺制冷机组：2026年5月安装，满充注量1,490磅，制冷剂GWP为675"
    },
    {
      "name": "select_d",
      "type": "BINARY",
      "lb": 0,
      "ub": 1,
      "meaning": "纳入2027年制冷设施网络的D号工业工艺制冷机组：2015年8月安装，满充注量1,700磅，制冷剂GWP为675"
    },
    {
      "name": "select_e",
      "type": "BINARY",
      "lb": 0,
      "ub": 1,
      "meaning": "纳入2027年制冷设施网络的E号办公楼舒适制冷机组：2026年4月安装，满充注量1,700磅，制冷剂GWP为675"
    },
    {
      "name": "select_f",
      "type": "BINARY",
      "lb": 0,
      "ub": 1,
      "meaning": "纳入2027年制冷设施网络的F号工业工艺制冷机组：2019年9月安装，满充注量1,800磅，制冷剂GWP为675"
    },
    {
      "name": "direct_ald_hub",
      "type": "BINARY",
      "lb": 0,
      "ub": 1,
      "meaning": "部署一套直接式自动检漏共享监测中心"
    },
    {
      "name": "indirect_ald_hub",
      "type": "BINARY",
      "lb": 0,
      "ub": 1,
      "meaning": "部署一套间接式自动检漏共享监测中心"
    }
  ],
  "objective": {
    "sense": "max",
    "constant": 0,
    "coefficients": {
      "select_a": 34,
      "select_b": 30,
      "select_c": 29,
      "select_d": 28,
      "select_e": 27,
      "select_f": 32,
      "direct_ald_hub": -12,
      "indirect_ald_hub": -12
    },
    "meaning": "入网机组运行效益减去共享监测中心成本",
    "unit": "净效益点"
  },
  "constraints": [
    {
      "name": "select_three_appliances",
      "sense": "=",
      "rhs": 3,
      "coefficients": {
        "select_a": 1,
        "select_b": 1,
        "select_c": 1,
        "select_d": 1,
        "select_e": 1,
        "select_f": 1
      },
      "meaning": "恰好纳入三台机组"
    },
    {
      "name": "at_most_one_ald_hub",
      "sense": "<=",
      "rhs": 1,
      "coefficients": {
        "direct_ald_hub": 1,
        "indirect_ald_hub": 1
      },
      "meaning": "共享网络至多部署一套检漏中心"
    }
  ],
  "action_projection": [
    "select_a",
    "select_b",
    "select_c",
    "select_d",
    "select_e",
    "select_f",
    "direct_ald_hub",
    "indirect_ald_hub"
  ]
}
