{
  "schema_version": "searchworthyor.rapid_model_ir.v0",
  "id": "SWOR-R019",
  "variant": "base",
  "family": "telecom_service",
  "source_candidate_id": "SRCV3-R019-FCC-24-78-NG911-TWO-CLOCKS",
  "variables": [
    {
      "name": "nationwide_fast",
      "type": "BINARY",
      "lb": 0,
      "ub": 1,
      "meaning": "全国CMRS一期采用5.9个月方案"
    },
    {
      "name": "nationwide_slow",
      "type": "BINARY",
      "lb": 0,
      "ub": 1,
      "meaning": "全国CMRS一期采用11.9个月方案"
    },
    {
      "name": "nonwide_12",
      "type": "BINARY",
      "lb": 0,
      "ub": 1,
      "meaning": "非全国CMRS一期采用11.9个月方案"
    },
    {
      "name": "nonwide_13",
      "type": "BINARY",
      "lb": 0,
      "ub": 1,
      "meaning": "非全国CMRS一期采用13个月方案"
    },
    {
      "name": "voip_phase2_6",
      "type": "BINARY",
      "lb": 0,
      "ub": 1,
      "meaning": "互联VoIP二期采用后锚点后5.9个月方案"
    },
    {
      "name": "voip_phase2_12",
      "type": "BINARY",
      "lb": 0,
      "ub": 1,
      "meaning": "互联VoIP二期采用后锚点后11.9个月方案"
    },
    {
      "name": "rlec_phase2_12",
      "type": "BINARY",
      "lb": 0,
      "ub": 1,
      "meaning": "农村本地交换商二期采用后锚点后11.9个月方案"
    },
    {
      "name": "rlec_phase2_13",
      "type": "BINARY",
      "lb": 0,
      "ub": 1,
      "meaning": "农村本地交换商二期采用后锚点后13个月方案"
    }
  ],
  "objective": {
    "sense": "max",
    "constant": 0,
    "coefficients": {
      "nationwide_fast": 18,
      "nationwide_slow": 26,
      "nonwide_12": 24,
      "nonwide_13": 29,
      "voip_phase2_6": 17,
      "voip_phase2_12": 25,
      "rlec_phase2_12": 23,
      "rlec_phase2_13": 28
    },
    "meaning": "Total engineering value of four handoff schedules",
    "unit": "工程价值点"
  },
  "constraints": [
    {
      "name": "one_nationwide_schedule",
      "sense": "=",
      "rhs": 1,
      "coefficients": {
        "nationwide_fast": 1,
        "nationwide_slow": 1
      },
      "meaning": "Choose one nationwide CMRS schedule"
    },
    {
      "name": "one_nonwide_schedule",
      "sense": "=",
      "rhs": 1,
      "coefficients": {
        "nonwide_12": 1,
        "nonwide_13": 1
      },
      "meaning": "Choose one non-nationwide CMRS schedule"
    },
    {
      "name": "one_voip_phase2_schedule",
      "sense": "=",
      "rhs": 1,
      "coefficients": {
        "voip_phase2_6": 1,
        "voip_phase2_12": 1
      },
      "meaning": "Choose one interconnected-VoIP Phase 2 schedule"
    },
    {
      "name": "one_rlec_phase2_schedule",
      "sense": "=",
      "rhs": 1,
      "coefficients": {
        "rlec_phase2_12": 1,
        "rlec_phase2_13": 1
      },
      "meaning": "Choose one RLEC Phase 2 schedule"
    },
    {
      "name": "one_long_window_acceptance_lab",
      "sense": "<=",
      "rhs": 1,
      "coefficients": {
        "nonwide_13": 1,
        "rlec_phase2_13": 1
      },
      "meaning": "Only one thirteen-month plan can use the long-window acceptance lab"
    }
  ],
  "action_projection": [
    "nationwide_fast",
    "nationwide_slow",
    "nonwide_12",
    "nonwide_13",
    "voip_phase2_6",
    "voip_phase2_12",
    "rlec_phase2_12",
    "rlec_phase2_13"
  ]
}
