{
  "schema_version": "searchworthyor.rapid_model_ir.v0",
  "id": "SWOR-R001",
  "variant": "patched",
  "family": "energy_environment",
  "source_candidate_id": "SRCV3-R001-EU-CBAM-2025-2083-50T",
  "variables": [
    {
      "name": "lot_a",
      "type": "BINARY",
      "lb": 0,
      "ub": 1,
      "meaning": "选择20吨批次A"
    },
    {
      "name": "lot_b",
      "type": "BINARY",
      "lb": 0,
      "ub": 1,
      "meaning": "选择18吨批次B"
    },
    {
      "name": "lot_c",
      "type": "BINARY",
      "lb": 0,
      "ub": 1,
      "meaning": "选择17吨批次C"
    },
    {
      "name": "lot_d",
      "type": "BINARY",
      "lb": 0,
      "ub": 1,
      "meaning": "选择16吨批次D"
    },
    {
      "name": "lot_e",
      "type": "BINARY",
      "lb": 0,
      "ub": 1,
      "meaning": "选择15吨批次E"
    },
    {
      "name": "lot_f",
      "type": "BINARY",
      "lb": 0,
      "ub": 1,
      "meaning": "选择14吨批次F"
    },
    {
      "name": "trade_support_p",
      "type": "BINARY",
      "lb": 0,
      "ub": 1,
      "meaning": "启用年度进口运营方案P"
    }
  ],
  "objective": {
    "sense": "max",
    "constant": 0,
    "coefficients": {
      "lot_a": 24,
      "lot_b": 23,
      "lot_c": 22,
      "lot_d": 21,
      "lot_e": 20,
      "lot_f": 19,
      "trade_support_p": -8
    },
    "meaning": "Total commercial value of three import lots net of any annual trade-operations package",
    "unit": "净进口价值点"
  },
  "constraints": [
    {
      "name": "select_three_import_lots",
      "sense": "=",
      "rhs": 3,
      "coefficients": {
        "lot_a": 1,
        "lot_b": 1,
        "lot_c": 1,
        "lot_d": 1,
        "lot_e": 1,
        "lot_f": 1
      },
      "meaning": "Select exactly three annual import lots"
    },
    {
      "coefficients": {
        "lot_a": 20,
        "lot_b": 18,
        "lot_c": 17,
        "lot_d": 16,
        "lot_e": 15,
        "lot_f": 14,
        "trade_support_p": -5
      },
      "meaning": "同一进口人同一日历年所选CBAM货物总净重超过50吨时，运营方案P提供本题所列执行能力",
      "name": "annual_mass_branch",
      "rhs": 50,
      "sense": "<="
    }
  ],
  "action_projection": [
    "lot_a",
    "lot_b",
    "lot_c",
    "lot_d",
    "lot_e",
    "lot_f",
    "trade_support_p"
  ]
}
