{
  "schema_version": "searchworthyor.rapid_model_ir.v0",
  "id": "SWOR-R067",
  "variant": "base",
  "family": "finance_portfolio",
  "source_candidate_id": "LOW-C2-R067-IRS-DIVERSIFICATION",
  "variables": [
    {
      "name": "horizon_40m",
      "type": "BINARY",
      "lb": 0,
      "ub": 1,
      "meaning": "配置4000万美元Horizon Manufacturing债券块"
    },
    {
      "name": "meridian_35m",
      "type": "BINARY",
      "lb": 0,
      "ub": 1,
      "meaning": "配置3500万美元Meridian Data Systems债券块"
    },
    {
      "name": "novacore_30m",
      "type": "BINARY",
      "lb": 0,
      "ub": 1,
      "meaning": "配置3000万美元NovaCore Utilities债券块"
    },
    {
      "name": "orion_25m",
      "type": "BINARY",
      "lb": 0,
      "ub": 1,
      "meaning": "配置2500万美元Orion Medical Holdings债券块"
    },
    {
      "name": "prairie_20m",
      "type": "BINARY",
      "lb": 0,
      "ub": 1,
      "meaning": "配置2000万美元Prairie Logistics债券块"
    },
    {
      "name": "quartz_20m",
      "type": "BINARY",
      "lb": 0,
      "ub": 1,
      "meaning": "配置2000万美元Quartz Materials债券块"
    },
    {
      "name": "ridge_15m",
      "type": "BINARY",
      "lb": 0,
      "ub": 1,
      "meaning": "配置1500万美元Ridge Telecom债券块"
    },
    {
      "name": "summit_15m",
      "type": "BINARY",
      "lb": 0,
      "ub": 1,
      "meaning": "配置1500万美元Summit Foods债券块"
    },
    {
      "name": "tidal_10m",
      "type": "BINARY",
      "lb": 0,
      "ub": 1,
      "meaning": "配置1000万美元Tidal Software债券块"
    },
    {
      "name": "union_10m",
      "type": "BINARY",
      "lb": 0,
      "ub": 1,
      "meaning": "配置1000万美元Union Packaging债券块"
    }
  ],
  "objective": {
    "sense": "max",
    "constant": 0,
    "coefficients": {
      "horizon_40m": 160,
      "meridian_35m": 157,
      "novacore_30m": 154,
      "orion_25m": 151,
      "prairie_20m": 148,
      "quartz_20m": 145,
      "ridge_15m": 20,
      "summit_15m": 18,
      "tidal_10m": 16,
      "union_10m": 14
    },
    "meaning": "所选动作的总季度风险调整收益点",
    "unit": "季度风险调整收益点"
  },
  "constraints": [
    {
      "name": "segregated_account_value",
      "sense": "=",
      "rhs": 100,
      "coefficients": {
        "horizon_40m": 40,
        "meridian_35m": 35,
        "novacore_30m": 30,
        "orion_25m": 25,
        "prairie_20m": 20,
        "quartz_20m": 20,
        "ridge_15m": 15,
        "summit_15m": 15,
        "tidal_10m": 10,
        "union_10m": 10
      },
      "meaning": "入选资产块合计恰好1亿美元"
    }
  ],
  "action_projection": [
    "horizon_40m",
    "meridian_35m",
    "novacore_30m",
    "orion_25m",
    "prairie_20m",
    "quartz_20m",
    "ridge_15m",
    "summit_15m",
    "tidal_10m",
    "union_10m"
  ]
}
