{
  "schema_version": "searchworthyor.rapid_model_ir.v0",
  "id": "SWOR-R086",
  "variant": "base",
  "family": "facility_network",
  "source_candidate_id": "A4-R086-EPA-SPCC-TIMELINE",
  "variables": [
    {
      "name": "pkg_review5_amend6_impl6",
      "type": "BINARY",
      "lb": 0,
      "ub": 1,
      "meaning": "采用5年复核、6个月修订、再6个月实施方案"
    },
    {
      "name": "pkg_review5_amend9_impl6",
      "type": "BINARY",
      "lb": 0,
      "ub": 1,
      "meaning": "采用5年复核、9个月后修订方案"
    },
    {
      "name": "pkg_review7_amend6_impl6",
      "type": "BINARY",
      "lb": 0,
      "ub": 1,
      "meaning": "采用7年首次复核方案"
    },
    {
      "name": "pkg_review5_amend6_impl9",
      "type": "BINARY",
      "lb": 0,
      "ub": 1,
      "meaning": "采用5年复核、6个月修订、9个月后实施方案"
    }
  ],
  "objective": {
    "sense": "max",
    "constant": 0,
    "coefficients": {
      "pkg_review5_amend6_impl6": 18,
      "pkg_review5_amend9_impl6": 23,
      "pkg_review7_amend6_impl6": 22,
      "pkg_review5_amend6_impl9": 21
    },
    "meaning": "Total decision value",
    "unit": "设施防护净效用点"
  },
  "constraints": [
    {
      "name": "choose_one_timeline",
      "sense": "=",
      "rhs": 1,
      "coefficients": {
        "pkg_review5_amend6_impl6": 1,
        "pkg_review5_amend9_impl6": 1,
        "pkg_review7_amend6_impl6": 1,
        "pkg_review5_amend6_impl9": 1
      },
      "meaning": "Exactly one listed package must be selected"
    }
  ],
  "action_projection": [
    "pkg_review5_amend6_impl6",
    "pkg_review5_amend9_impl6",
    "pkg_review7_amend6_impl6",
    "pkg_review5_amend6_impl9"
  ]
}
