{
  "action_projection": [
    "aggregate",
    "plastic_bottle",
    "paper_box",
    "metal_can",
    "glass_jar"
  ],
  "constraints": [
    {
      "coefficients": {
        "aggregate": 1,
        "glass_jar": 1,
        "metal_can": 1,
        "paper_box": 1,
        "plastic_bottle": 1
      },
      "meaning": "至少建立一张包装数据表",
      "name": "at_least_one_table",
      "rhs": 1,
      "sense": ">="
    },
    {
      "coefficients": {
        "aggregate": 1,
        "glass_jar": 1,
        "metal_can": 1,
        "paper_box": 1,
        "plastic_bottle": 1
      },
      "meaning": "数据系统至多建立四张表",
      "name": "table_capacity",
      "rhs": 4,
      "sense": "<="
    },
    {
      "coefficients": {
        "plastic_bottle": 1
      },
      "meaning": "按塑料材质和瓶装形态报告重量",
      "name": "plastic_material_form",
      "rhs": 1,
      "sense": "="
    },
    {
      "coefficients": {
        "paper_box": 1
      },
      "meaning": "按纸材质和盒装形态报告重量",
      "name": "paper_material_form",
      "rhs": 1,
      "sense": "="
    },
    {
      "coefficients": {
        "metal_can": 1
      },
      "meaning": "按金属材质和罐装形态报告重量",
      "name": "metal_material_form",
      "rhs": 1,
      "sense": "="
    }
  ],
  "family": "scheduling_workforce",
  "id": "SWOR-R018",
  "objective": {
    "coefficients": {
      "aggregate": 1,
      "glass_jar": 2,
      "metal_can": 5,
      "paper_box": 4,
      "plastic_bottle": 3
    },
    "constant": 0,
    "meaning": "包装数据表编制成本",
    "sense": "min",
    "unit": "千新元"
  },
  "schema_version": "searchworthyor.rapid_model_ir.v0",
  "source_candidate_id": "SRCV2-0146",
  "variables": [
    {
      "lb": 0,
      "meaning": "建立包装总重量表",
      "name": "aggregate",
      "type": "BINARY",
      "ub": 1
    },
    {
      "lb": 0,
      "meaning": "建立塑料瓶重量表",
      "name": "plastic_bottle",
      "type": "BINARY",
      "ub": 1
    },
    {
      "lb": 0,
      "meaning": "建立纸盒重量表",
      "name": "paper_box",
      "type": "BINARY",
      "ub": 1
    },
    {
      "lb": 0,
      "meaning": "建立金属罐重量表",
      "name": "metal_can",
      "type": "BINARY",
      "ub": 1
    },
    {
      "lb": 0,
      "meaning": "建立玻璃罐重量表",
      "name": "glass_jar",
      "type": "BINARY",
      "ub": 1
    }
  ],
  "variant": "patched"
}
